    User Input,Chatbot Responses,Timestamp
    hello,Hi there! How can I help you today,2024-09-11 01:21:51
    how are you,I'm doing well, thank you for asking,2024-09-11 01:21:51
    what is your name,I'm a chatbot created to help you,2024-09-11 01:21:51
    bye,Goodbye! Have a great day,2024-09-11 01:21:51
    help,I can help you with basic questions and conversation. Just type your message,2024-09-11 01:21:51
    weather,I'm sorry, I don't have access to weather information,2024-09-11 01:21:51
    thank you,You're welcome,2024-09-11 01:21:51

